{
  "mode": "3d", "script": "advanced.py", "gravity": [0,-10,0],
  "background": [0.015,0.025,0.045,1],
  "camera": {"position":[0,3,8],"target":[0,1,0],"fov":60},
  "rendering": {
    "ambient":[0.12,0.15,0.22], "shadow_size":1024,
    "lights":[
      {"type":"directional","direction":[-0.4,-1,-0.35],"color":[0.7,0.85,1],"intensity":0.9,"shadows":true,"shadow_extent":15},
      {"type":"point","position":[3,3,0],"color":[1,0.35,0.12],"intensity":2,"range":12}
    ],
    "targets":{"security":{"width":320,"height":180,"position":[6,5,6],"target":[0,0,0],"mode":"3d"}},
    "postprocess":{"bloom":0.15,"vignette":0.2,"grain":0.015,"gamma":1}
  },
  "entities":[
    {"id":"floor","name":"Floor","kind":"cube","position":[0,-0.5,0],"scale":[20,1,20],"collider":[20,1,20],"color":[0.18,0.22,0.28,1]},
    {"id":"wall","name":"Wall","kind":"cube","position":[-3,1,0],"scale":[1,2,4],"collider":[1,2,4],"color":[0.15,0.45,0.65,1]},
    {"id":"obstacle","name":"Obstacle","kind":"cube","position":[3,1,0],"scale":[2,2,2],"collider":[2,2,2],"color":[0.65,0.28,0.1,1]},
    {"id":"player","name":"Kinematic character","kind":"cube","position":[0,1,3],"scale":[0.8,1.8,0.8],"collider":[0.8,1.8,0.8],"color":[0.24,0.76,0.63,1]},
    {"id":"animated","name":"Skinned glTF","kind":"mesh","model":"animated_triangle.gltf","position":[0,2,0],"animation":"Move"},
    {"id":"monitor","name":"Security monitor","kind":"sprite","screen":true,"texture":"@target:security","position":[1080,130,0],"scale":[320,180,1],"casts_shadow":false}
  ]
}
