{
  "mode": "2d",
  "background": [0.035, 0.047, 0.075, 1],
  "gravity": [0, 980, 0],
  "script": "welcome.py",
  "entities": [
    {"id": "terrain", "kind": "sprite", "position": [640, 510, 0], "scale": [1160, 170, 1], "texture": "grid.png", "color": [0.28, 0.4, 0.43, 1]},
    {"id": "floor", "kind": "empty", "position": [640, 562, 0], "collider": [1160, 26, 1]},
    {"id": "player", "prefab": "player.json", "position": [260, 450, 1]},
    {"id": "platform", "kind": "sprite", "position": [650, 476, 1], "scale": [160, 20, 1], "collider": [160, 20, 1], "color": [0.4, 0.8, 0.65, 1]},
    {"id": "checkpoint", "kind": "sprite", "name": "Контрольная точка", "position": [1090, 516, 1], "scale": [20, 66, 1], "collider": [20, 66, 1], "trigger": true, "color": [1, 0.7, 0.25, 1]}
  ]
}
